"number","workflow_state","sys_created_on","published","u_review_date","short_description","kb_knowledge_base","author","sys_view_count","use_count","helpful_count","flagged","rating","kb_category","u_workflow_topic","sys_created_by","sys_mod_count","sys_updated_on","sys_updated_by","retired","sys_tags","meta","direct"
"KB000134125","published","2021-12-23 08:33:31","2025-05-07","2026-05-07 10:56:55","Activ Infinite - Messages bloquants WAF","b98d9b7f1b1974501087eb186e4bcb85","6861b68a0f9496009850ecd692050ee7","0","0","0","0","","efbf5336dbfbf414115aff4239961981","6073c40c1bad74501087eb186e4bcb26","ATOSA570299","70","2025-05-07 10:56:55","ATOSA570299","","","Activ_Infinite, WAF, Messages_bloquants","0"
"KB000133842","published","2021-12-09 10:17:56","2025-05-07","2026-05-07 10:46:50","Installation des produits sous Adobe CreativeCloud","b98d9b7f1b1974501087eb186e4bcb85","6861b68a0f9496009850ecd692050ee7","3","0","0","0","","ac56fa731b97c950c99feacce54bcbb2","6073c40c1bad74501087eb186e4bcb26","ATOSA570299","76","2025-05-07 10:46:50","ATOSA570299","","","CreativeCloud, Adobe, Installation","0"
"KB000138677","published","2022-05-25 14:02:16","2025-05-07","2026-05-07 12:27:41","Installation de CCSupervision","b98d9b7f1b1974501087eb186e4bcb85","6861b68a0f9496009850ecd692050ee7","3","0","0","0","","3da9a07f872fc1d438b0a6440cbb3528","6073c40c1bad74501087eb186e4bcb26","ATOSA570299","26","2025-05-07 12:27:41","ATOSA570299","","","CCSupervision, Installation, Installer","0"
"KB000137514","published","2022-04-05 13:30:20","2025-05-07","2026-05-07 11:19:54","Création des incidents sur Jira","b98d9b7f1b1974501087eb186e4bcb85","6861b68a0f9496009850ecd692050ee7","11","0","0","0","","016cbff71b5d74501087eb186e4bcbd5","6073c40c1bad74501087eb186e4bcb26","ATOSA570299","53","2025-05-07 11:19:54","ATOSA570299","","","Jira, Incidents, Création, Créer, Guide","0"
"KB000148223","published","2023-03-22 15:12:35","2025-05-07","2026-05-07 12:50:41","Process Allocutions PDG / COMEX","b98d9b7f1b1974501087eb186e4bcb85","6861b68a0f9496009850ecd692050ee7","3","0","0","0","","2ee040c41bad74501087eb186e4bcbf3","d8534cc81bad74501087eb186e4bcb14","ATOSA570299","23","2025-05-07 12:50:41","ATOSA570299","","","PDG, COMEX, Allocutions, Process","0"
"KB000142455","published","2022-09-21 15:19:46","2025-05-07","2026-05-07 12:41:48","Installation de l'imprimante réseau Dell 3460DN","b98d9b7f1b1974501087eb186e4bcb85","6861b68a0f9496009850ecd692050ee7","5","0","0","0","","6026fbf71b1d74501087eb186e4bcb4f","6073c40c1bad74501087eb186e4bcb26","ATOSA570299","40","2025-05-07 12:41:48","ATOSA570299","","","Dell, 3460DN, Iimprimante, Réseau, Installation, Connexion","0"
"KB000129795","published","2021-08-02 10:55:22","2025-05-07","2026-05-07 10:21:02","Impression recto verso #EA","b98d9b7f1b1974501087eb186e4bcb85","6861b68a0f9496009850ecd692050ee7","3","0","0","0","","6026fbf71b1d74501087eb186e4bcb4f","4a68c0441bed74501087eb186e4bcb88","ATOSA771963","113","2025-05-07 10:21:02","ATOSA570299","","","Recto_Verso, Impression, Imprimante, Toshiba, Paramétrage, Epargne_Actuelle, EA","0"
"KB000136055","published","2022-03-03 11:03:55","2025-05-07","2026-05-07 11:07:36","Support du Samedi #Eurofil","b98d9b7f1b1974501087eb186e4bcb85","6861b68a0f9496009850ecd692050ee7","3","0","1","0","","780174d987952d10c9b8a6440cbb3572","d8534cc81bad74501087eb186e4bcb14","ATOSA570299","65","2025-05-07 11:07:36","ATOSA570299","","","Samedi, Eurofil","0"
"KB000133635","published","2021-12-01 16:15:14","2025-05-07","2026-05-07 10:45:34","TOUT EN 2 CLICS - Version obsolète","b98d9b7f1b1974501087eb186e4bcb85","6861b68a0f9496009850ecd692050ee7","3","0","0","0","","133377d7db0845988e74763239961939","6073c40c1bad74501087eb186e4bcb26","ATOSA570299","97","2025-05-07 10:45:34","ATOSA570299","","","Tout_en_2_clics, Version_obsolète, Expiration","0"
"KB000138212","published","2022-05-04 15:44:23","2025-05-07","2026-05-07 11:24:56","Installation et déclaration poste de l'application Prysm AppVision","b98d9b7f1b1974501087eb186e4bcb85","6861b68a0f9496009850ecd692050ee7","3","0","0","0","","d208f84187d38d14e8614338cebb35cc","6073c40c1bad74501087eb186e4bcb26","ATOSA570299","13","2025-05-07 11:24:56","ATOSA570299","","","Prysm, AppVision, Installation, Déclaration, Poste","0"
"KB000134243","published","2022-01-04 11:36:33","2025-05-07","2026-05-07 10:57:52","Erreurs d'installation de CCSupervision","b98d9b7f1b1974501087eb186e4bcb85","6861b68a0f9496009850ecd692050ee7","3","0","0","0","","3da9a07f872fc1d438b0a6440cbb3528","6073c40c1bad74501087eb186e4bcb26","ATOSA570299","115","2025-05-07 10:57:52","ATOSA570299","2022-07-04","","CCSupervision, Installation, Utilisation, Problèmes, Erreurs, Dépannage","0"
"KB000134706","published","2022-01-26 08:52:12","2025-05-07","2026-05-07 11:02:23","Chronogestor - Utilisateur SXXX inconnu dans la base","b98d9b7f1b1974501087eb186e4bcb85","6861b68a0f9496009850ecd692050ee7","3","0","0","0","","7a8def331bd974501087eb186e4bcb01","d8534cc81bad74501087eb186e4bcb14","ATOSA570299","71","2025-05-07 11:02:23","ATOSA570299","","","Chronogestor, Uilisateur_SXXX_inconnu_dans_la_base, Authentification, Erreur","0"
"KB000134360","published","2022-01-11 13:12:32","2025-05-07","2026-05-07 11:01:08","Scan to mail et récupération-indexation des documents #EA","b98d9b7f1b1974501087eb186e4bcb85","6861b68a0f9496009850ecd692050ee7","3","0","0","0","","6026fbf71b1d74501087eb186e4bcb4f","6073c40c1bad74501087eb186e4bcb26","ATOSA570299","41","2025-05-07 11:01:08","ATOSA570299","","","Scan, Mail, Scan_to_mail, Récupération, Indexation, Epargne_Actuelle, EA","0"
"KB000144099","published","2022-11-21 08:05:54","2025-05-07","2026-05-07 12:45:27","Demande d'ajout d'un plugin au navigateur","b98d9b7f1b1974501087eb186e4bcb85","6861b68a0f9496009850ecd692050ee7","2","0","0","0","","6d55a05987512d10c9b8a6440cbb357b","d8534cc81bad74501087eb186e4bcb14","ATOSA570299","18","2025-05-07 12:45:27","ATOSA570299","","","Plugin, Ajout, Navigateur, Browser, Demande, Process","0"
"KB000129805","published","2021-08-02 10:55:28","2025-05-07","2026-05-07 10:24:51","EAC - Problème affichage hors champ","b98d9b7f1b1974501087eb186e4bcb85","6861b68a0f9496009850ecd692050ee7","3","0","0","0","","197eaff31bd974501087eb186e4bcb62","4a68c0441bed74501087eb186e4bcb88","ATOSA771963","32","2025-05-07 10:24:51","ATOSA570299","","","EAC, Affichage, Hors_champ","0"
"KB000136385","published","2022-03-15 09:57:56","2025-05-07","2026-05-07 11:09:35","Copieur non fonctionnel suite à une coupure électrique","b98d9b7f1b1974501087eb186e4bcb85","6861b68a0f9496009850ecd692050ee7","6","0","0","0","","6026fbf71b1d74501087eb186e4bcb4f","6073c40c1bad74501087eb186e4bcb26","ATOSA570299","81","2025-05-07 11:11:07","ATOSA570299","","","Copieur, Imprimante, PC, Non_fonctionnel, Hors_service, HS, Coupure_électrique, Arrêt, Relance, Arrêter, Allumer, Rallumer","0"
"KB000138448","published","2022-05-16 12:45:24","2025-05-07","2026-05-07 12:24:29","Installation manuelle de IP Desktop Softphone","b98d9b7f1b1974501087eb186e4bcb85","6861b68a0f9496009850ecd692050ee7","3","0","0","0","","33710a3c1beb09903d89dc27bd4bcbc7","6073c40c1bad74501087eb186e4bcb26","ATOSA570299","35","2025-05-07 12:24:29","ATOSA570299","","","IPDesktopSoftphone, IP_Desktop_Softphone, Softphone, Softphonie, Installation, Installation_manuelle, Installer","0"
"KB000134359","published","2022-01-11 13:06:54","2025-05-07","2026-05-07 11:01:45","Paramétrage Outlook #EA","b98d9b7f1b1974501087eb186e4bcb85","6861b68a0f9496009850ecd692050ee7","3","0","0","0","","f4d033fb1bd974501087eb186e4bcb2e","6073c40c1bad74501087eb186e4bcb26","ATOSA570299","121","2025-05-07 11:01:45","ATOSA570299","","","Outlook, Paramétrage, EA, Epargne_Actuelle","0"
"KB000133079","published","2021-11-10 11:29:28","2025-05-07","2026-05-07 10:44:55","Erreur lancement GED Vie en télétravail","b98d9b7f1b1974501087eb186e4bcb85","6861b68a0f9496009850ecd692050ee7","3","0","0","0","","be9ea7371bd974501087eb186e4bcb49","6073c40c1bad74501087eb186e4bcb26","ATOSA570299","39","2025-05-07 10:44:55","ATOSA570299","","","GED, Erreur, Lancement, Télétravail","0"
"KB000136090","published","2022-03-04 12:17:40","2025-05-07","2026-05-07 11:08:10","Chronogestor","b98d9b7f1b1974501087eb186e4bcb85","6861b68a0f9496009850ecd692050ee7","3","0","0","0","","7a8def331bd974501087eb186e4bcb01","ddc2cc881bad74501087eb186e4bcb26","ATOSA570299","30","2025-05-07 11:08:10","ATOSA570299","","","Chronogestor, Présentation, Introduction, Information, Fiche","0"
"KB000129747","published","2021-08-02 10:54:48","2025-05-07","2026-05-07 10:29:50","Paramétrage d'un écran externe","b98d9b7f1b1974501087eb186e4bcb85","6861b68a0f9496009850ecd692050ee7","3","0","0","0","","6b3cb4251b270114d6200dcfe54bcb5b","6073c40c1bad74501087eb186e4bcb26","ATOSA771963","48","2025-05-07 10:29:50","ATOSA570299","","","Affichage, Ecran_externe, Double, Triple, Ecrans, Paramétrage, Paramétrer","0"
"KB000136138","published","2022-03-07 13:22:22","2025-05-07","2026-05-07 11:09:03","Impression impossible ""Aucun document dans la liste d'attente""","b98d9b7f1b1974501087eb186e4bcb85","6861b68a0f9496009850ecd692050ee7","3","0","0","0","","6026fbf71b1d74501087eb186e4bcb4f","6073c40c1bad74501087eb186e4bcb26","ATOSA570299","33","2025-05-07 11:09:03","ATOSA570299","","","Imprimante_réseau, Printer, Impression, Impossible, Incident, Connexion_impossible, file_d'attente_vide, file, KB5000808","0"
"KB000129837","published","2021-08-02 10:55:50","2025-05-07","2026-05-07 10:32:49","Consommables de l'imprimante Xerox 7855","b98d9b7f1b1974501087eb186e4bcb85","6861b68a0f9496009850ecd692050ee7","4","0","1","0","","6026fbf71b1d74501087eb186e4bcb4f","4a68c0441bed74501087eb186e4bcb88","ATOSA771963","43","2025-05-07 10:32:49","ATOSA570299","","","Xerox_7855, Consommables, Printer, Ancre, Cartouche, Imprimante, MFD","0"
"KB000140625","published","2022-07-25 15:06:28","2025-05-07","2026-05-07 12:37:18","Softphonie - Serveur inaccessible","b98d9b7f1b1974501087eb186e4bcb85","6861b68a0f9496009850ecd692050ee7","3","0","0","0","","37a4bbf31b1d74501087eb186e4bcb24","6073c40c1bad74501087eb186e4bcb26","ATOSA570299","19","2025-05-07 12:37:18","ATOSA570299","","","Softphonie, Softphone, Serveur_inaccessible, Serveur, Inaccessible","0"
"KB000138351","published","2022-05-11 12:15:04","2025-05-07","2026-05-07 12:23:00","Installation de iSpring Suite","b98d9b7f1b1974501087eb186e4bcb85","6861b68a0f9496009850ecd692050ee7","3","0","0","0","","b6ca80531b1385101856dc6fe54bcb6e","6073c40c1bad74501087eb186e4bcb26","ATOSA570299","46","2025-05-07 12:23:00","ATOSA570299","","","iSpring, iSpring_Suite, Installation, Licence, Activation, Installer, Activer","0"
"KB000133870","published","2021-12-10 10:49:49","2025-05-07","2026-05-07 10:47:29","Paramétrage du BIOS","b98d9b7f1b1974501087eb186e4bcb85","6861b68a0f9496009850ecd692050ee7","3","0","0","0","","2bf5f7f71b1d74501087eb186e4bcb23","6073c40c1bad74501087eb186e4bcb26","ATOSA570299","189","2025-05-07 10:47:29","ATOSA570299","","","BIOS, Asset_Tag, Paramétrage, Paramétrer, Latitude_5400, Latitude_7480, Latitude_7490, Precision_5540, Latitude_5410, Latitude_5420, Precision_5550","0"
"KB000138612","published","2022-05-23 11:57:38","2025-05-07","2026-05-07 12:25:53","Demande d'accès au groupe AD « PSG_FR_CISO_SOFTWARE_DOWNLOADS »","b98d9b7f1b1974501087eb186e4bcb85","6861b68a0f9496009850ecd692050ee7","8","0","0","0","","3f55e45987512d10c9b8a6440cbb3532","6073c40c1bad74501087eb186e4bcb26","ATOSA570299","27","2025-05-07 12:25:53","ATOSA570299","","","Demande, Accès, Groupe_AD, Groupe, AD, PSG_FR_CISO_SOFTWARE_DOWNLOADS","0"
"KB000138245","published","2022-05-06 08:02:19","2025-05-07","2026-05-07 11:25:24","Erreur lors de l'ajout d'une imprimante réseau","b98d9b7f1b1974501087eb186e4bcb85","6861b68a0f9496009850ecd692050ee7","3","0","0","0","","6026fbf71b1d74501087eb186e4bcb4f","6073c40c1bad74501087eb186e4bcb26","ATOSA570299","26","2025-05-07 11:25:24","ATOSA570299","","","Imprimante_réseau, Imprimante, Réseau, Erreur, Ajout, Ajouter, Correction, Correctif, KB5000808","0"
"KB000138672","published","2022-05-25 12:01:30","2025-05-07","2026-05-07 12:26:35","Installation de CA Introscope","b98d9b7f1b1974501087eb186e4bcb85","6861b68a0f9496009850ecd692050ee7","3","0","0","0","","19ddcc3b87e381d438b0a6440cbb3563","6073c40c1bad74501087eb186e4bcb26","ATOSA570299","37","2025-05-07 12:26:35","ATOSA570299","","","CA, Introscope, Workstation, CA_Introscope, CaT_IntroscopeWorkstation, Installation, Installer","0"
"KB000137802","published","2022-04-15 13:00:59","2025-05-07","2026-05-07 11:21:34","Installation de ThinkCell","b98d9b7f1b1974501087eb186e4bcb85","6861b68a0f9496009850ecd692050ee7","7","0","0","0","","f84d17771b970d50c99feacce54bcbd4","6073c40c1bad74501087eb186e4bcb26","ATOSA570299","16","2025-05-07 11:21:34","ATOSA570299","","","ThinkCell, Think-Cell, Installation, Installer","0"
"KB000129726","published","2021-08-02 10:54:34","2025-05-07","2026-05-07 10:26:53","Réinitialisation du mot de passe GED","b98d9b7f1b1974501087eb186e4bcb85","6861b68a0f9496009850ecd692050ee7","3","0","0","0","","be9ea7371bd974501087eb186e4bcb49","4a68c0441bed74501087eb186e4bcb88","ATOSA771963","53","2025-05-07 10:26:53","ATOSA570299","","","GED, Mot_de_passe, MDP, Réinitialisation, Réinitialiser, Reset","0"
"KB000133873","published","2021-12-10 12:05:51","2025-05-07","2026-05-07 10:48:05","AS400 - EMU IBM PCOM - Blocage installation PCOM","b98d9b7f1b1974501087eb186e4bcb85","6861b68a0f9496009850ecd692050ee7","4","0","0","0","","4fbc2bbf1b9974501087eb186e4bcb7f","6073c40c1bad74501087eb186e4bcb26","ATOSA570299","26","2025-05-07 10:48:05","ATOSA570299","","","AS400, EMU, IBM, PCOM, Installation, Blocage","0"
"KB000142814","published","2022-09-29 09:25:24","2025-05-07","2026-05-07 12:42:34","Configuration de Lotus Notes 8.5 sur un poste SOE","b98d9b7f1b1974501087eb186e4bcb85","6861b68a0f9496009850ecd692050ee7","5","0","0","0","","80ff6f3b1bd974501087eb186e4bcb63","6073c40c1bad74501087eb186e4bcb26","ATOSA570299","28","2025-05-07 12:42:34","ATOSA570299","","","Lotus_Notes, 8.5, Poste_SOE, Configuration, Cofigurer","0"
"KB000130542","published","2021-08-25 18:01:02","2025-05-07","2026-05-07 10:44:17","Réinitialisation du mot de passe Graphtalk","b98d9b7f1b1974501087eb186e4bcb85","6861b68a0f9496009850ecd692050ee7","3","0","0","0","","c11fe7b71bd974501087eb186e4bcb21","6073c40c1bad74501087eb186e4bcb26","ATOSA570299","117","2025-05-07 10:44:17","ATOSA570299","","","Graphtalk, Oceanic, Mot_de_passe, MDP, Réinitialiser, Réinitialisation, Reset","0"
"KB000129796","published","2021-08-02 10:55:23","2025-05-07","2026-05-07 10:31:34","Connexion sans badge sur une imprimante multifonction Xerox","b98d9b7f1b1974501087eb186e4bcb85","6861b68a0f9496009850ecd692050ee7","3","0","0","0","","6026fbf71b1d74501087eb186e4bcb4f","4a68c0441bed74501087eb186e4bcb88","ATOSA771963","36","2025-05-07 10:31:34","ATOSA570299","","","Imprimante, Multifonction, Xerox, Sans_badge, Invité, Connexion","0"
"KB000136074","published","2022-03-03 16:09:14","2025-05-07","2026-05-07 11:06:40","Contacts SAV","b98d9b7f1b1974501087eb186e4bcb85","6861b68a0f9496009850ecd692050ee7","4","0","0","0","","2ee040c41bad74501087eb186e4bcbf3","ddc2cc881bad74501087eb186e4bcb26","ATOSA570299","41","2025-05-07 11:06:40","ATOSA570299","","","SAV, Numéro, Contact, Email, Adresse, Xerox, Toshiba, HP, Dell, Apple, Sagem, Spigraph, Ciblex, iCare, Polycom, GMH, NEDAP","0"
"KB000129816","published","2021-08-02 10:55:36","2025-05-07","2026-05-07 10:23:41","Consommables et panne copieur Toshiba #EA","b98d9b7f1b1974501087eb186e4bcb85","6861b68a0f9496009850ecd692050ee7","4","0","0","0","","6026fbf71b1d74501087eb186e4bcb4f","6058c0441bed74501087eb186e4bcb20","ATOSA771963","96","2025-05-07 10:23:41","ATOSA570299","","","Toshiba, Consommables, Toner, Panne, Copieur, Epargne_Actuelle, EA","0"
"KB000129775","published","2021-08-02 10:55:08","2025-05-07","2026-05-07 10:31:02","Réinitialisation du mot de passe de connexion aux imprimantes Xerox","b98d9b7f1b1974501087eb186e4bcb85","6861b68a0f9496009850ecd692050ee7","3","0","0","0","","6026fbf71b1d74501087eb186e4bcb4f","4a68c0441bed74501087eb186e4bcb88","ATOSA771963","53","2025-05-07 10:31:02","ATOSA570299","","","Xerox, Equitrac, Réinitialiser, Réinitialisation, Reset, Mot_de_pass, MDP, Password","0"
"KB000134020","published","2021-12-17 10:48:52","2025-05-07","2026-05-07 10:32:11","Incident d'accès à DARVA et BCA depuis l'AS400","b98d9b7f1b1974501087eb186e4bcb85","6861b68a0f9496009850ecd692050ee7","3","0","0","0","","4fbc2bbf1b9974501087eb186e4bcb7f","6073c40c1bad74501087eb186e4bcb26","ATOSA570299","44","2025-05-07 10:32:11","ATOSA570299","","","AS400, DARVA, BCA, Accèsn, Incident","0"
"KB000137209","published","2022-03-25 08:37:42","2025-05-07","2026-05-07 11:14:01","Restauration des fichiers par AIP","b98d9b7f1b1974501087eb186e4bcb85","6861b68a0f9496009850ecd692050ee7","5","0","0","0","","2ee040c41bad74501087eb186e4bcbf3","6073c40c1bad74501087eb186e4bcb26","ATOSA570299","316","2025-05-07 11:14:01","ATOSA570299","","","Restauration, Restaurer, Fichiers, CyberArk, Serveurs, ASTRIA, BURDA, CERATA, DOMIA, GIE-AFER, SRV3FI23, SSI00019","0"
"KB000137699","published","2022-04-11 14:42:34","2025-05-07","2026-05-07 11:20:49","Demandes de logiciels","b98d9b7f1b1974501087eb186e4bcb85","6861b68a0f9496009850ecd692050ee7","5","0","0","0","","6d55a05987512d10c9b8a6440cbb357b","d8534cc81bad74501087eb186e4bcb14","ATOSA570299","61","2025-05-07 11:20:49","ATOSA570299","","","Logiciel, Software, Demande, SharePoint, ServiceNow, SNOW","0"
"KB000137847","published","2022-04-19 09:05:49","2025-05-07","2026-05-07 11:22:05","Réinitialisation du mot de passe des applications 3270","b98d9b7f1b1974501087eb186e4bcb85","6861b68a0f9496009850ecd692050ee7","5","0","1","0","","4fbc2bbf1b9974501087eb186e4bcb7f","6073c40c1bad74501087eb186e4bcb26","ATOSA570299","45","2025-05-07 11:22:05","ATOSA570299","","","AS400, 3270, Applications, Mot_de_passe, MDP, Réinitialisation, Réinitialiser, Reset","0"
"KB000140905","published","2022-08-02 08:46:32","2025-05-07","2026-05-07 12:40:13","GlobalProtect","b98d9b7f1b1974501087eb186e4bcb85","6861b68a0f9496009850ecd692050ee7","6","0","0","0","","ece63f7b1b1d74501087eb186e4bcbd5","ddc2cc881bad74501087eb186e4bcb26","ATOSA570299","54","2025-05-07 12:40:13","ATOSA570299","","","GlobalProtect, Global, Protect, Abeille","0"
"KB000151219","published","2023-07-05 11:04:24","2025-05-07","2026-05-07 12:48:23","Imprimantes multifonctions Xerox - Qui fait quoi","b98d9b7f1b1974501087eb186e4bcb85","18552969db743280baa9f5f51d9619fb","5","0","0","0","","6026fbf71b1d74501087eb186e4bcb4f","d8534cc81bad74501087eb186e4bcb14","ATOSA661481","19","2025-05-07 12:48:23","ATOSA570299","","","Xerox, Imprimantes, multifonctions, installation, installer, déménagement, Qui_fait_qoi","0"
"KB000138184","published","2022-05-03 14:54:59","2025-05-07","2026-05-07 11:24:00","Installation d'Alcatel POPC Statistique","b98d9b7f1b1974501087eb186e4bcb85","6861b68a0f9496009850ecd692050ee7","4","0","0","0","","e7304e2d87578594c9b8a6440cbb35b1","6073c40c1bad74501087eb186e4bcb26","ATOSA570299","99","2025-05-07 11:24:00","ATOSA570299","","","StatPOPC, Alcatel_POPC_Statistique, Alcatel, POPC, Statistique, Installation","0"
"KB000140850","published","2022-07-29 16:13:57","2025-05-07","2026-05-07 12:39:01","Workday - Présentation et méthodes de connexion","b98d9b7f1b1974501087eb186e4bcb85","6861b68a0f9496009850ecd692050ee7","4","0","1","0","","a7e8ab36db733814115aff42399619e7","6073c40c1bad74501087eb186e4bcb26","ATOSA570299","75","2025-05-07 12:39:01","ATOSA570299","","","Workday, Information, Présentation, Introduction, Connexion, Lien","0"
"KB000129830","published","2021-08-02 10:55:46","2025-05-07","2026-05-07 10:25:26","EAC - Problème affichage mini","b98d9b7f1b1974501087eb186e4bcb85","6861b68a0f9496009850ecd692050ee7","3","0","0","0","","197eaff31bd974501087eb186e4bcb62","4a68c0441bed74501087eb186e4bcb88","ATOSA771963","49","2025-05-07 10:25:26","ATOSA570299","","","EAC, Affichage, Fenêtre, Mini, Petit","0"
"KB000138357","published","2022-05-11 14:47:41","2025-05-07","2026-05-07 12:22:26","Installation de FoxSoftware","b98d9b7f1b1974501087eb186e4bcb85","6861b68a0f9496009850ecd692050ee7","3","0","0","0","","f3bd689f879b0910e7cea6440cbb354b","6073c40c1bad74501087eb186e4bcb26","ATOSA570299","21","2025-05-07 12:22:26","ATOSA570299","","","FoxPro, FoxSoftware, ContratsEnDollars, Installation, Installer","0"
"KB000138474","published","2022-05-17 14:44:19","2025-05-07","2026-05-07 12:25:09","Installation et configuration de ResQ","b98d9b7f1b1974501087eb186e4bcb85","6861b68a0f9496009850ecd692050ee7","3","0","0","0","","3e55a70d87e345d038b0a6440cbb3555","6073c40c1bad74501087eb186e4bcb26","ATOSA570299","46","2025-05-07 12:25:09","ATOSA570299","","","ResQ, Towers, Installation, Configuration, Installer, Configurer, ODBC, SQL, Excel","0"
"KB000138404","published","2022-05-13 11:01:45","2025-05-07","2026-05-07 12:23:47","Installation du pilote NVIDIA Quadro T2000","b98d9b7f1b1974501087eb186e4bcb85","6861b68a0f9496009850ecd692050ee7","3","0","0","0","","705e56bf87138950b57e4338cebb355f","6073c40c1bad74501087eb186e4bcb26","ATOSA570299","48","2025-05-07 12:23:47","ATOSA570299","","","Adobe, Creative, NVIDIA, Quadro_T2000, Pilote, Driver, Installation, Mise_à_jour","0"
"KB000134264","published","2022-01-05 13:15:55","2025-05-07","2026-05-07 10:58:45","DocuSign MFA","b98d9b7f1b1974501087eb186e4bcb85","6861b68a0f9496009850ecd692050ee7","3","0","0","0","","5f46afbadbfff414115aff423996196a","6073c40c1bad74501087eb186e4bcb26","ATOSA570299","39","2025-05-07 10:58:45","ATOSA570299","","","DocuSign, MFA","0"
"KB000129755","published","2021-08-02 10:54:54","2025-05-07","2026-05-07 10:23:00","Installation des imprimantes Toshiba #EA","b98d9b7f1b1974501087eb186e4bcb85","6861b68a0f9496009850ecd692050ee7","3","0","0","0","","6026fbf71b1d74501087eb186e4bcb4f","4a68c0441bed74501087eb186e4bcb88","ATOSA771963","160","2025-05-07 10:23:00","ATOSA570299","2023-09-15","","Toshiba, Imprimante,  Multifonction, Installation, Installer, Connexion, Port, USB, Epargne_Actuelle, EA","0"
"KB000140933","published","2022-08-02 12:25:59","2025-05-07","2026-05-07 12:40:58","GlobalProtect - Incidents d'accès","b98d9b7f1b1974501087eb186e4bcb85","6861b68a0f9496009850ecd692050ee7","11","0","0","0","","ece63f7b1b1d74501087eb186e4bcbd5","6073c40c1bad74501087eb186e4bcb26","ATOSA570299","63","2025-05-07 12:40:58","ATOSA570299","","","GlobalProtect, Global, Protect, Incidents, Problèmes, Accès, Abeille","0"
"KB000139435","published","2022-06-23 13:34:56","2025-05-07","2026-05-07 12:29:32","Installation d'Oodrive Trusted Key Manager pour AWSolutions","b98d9b7f1b1974501087eb186e4bcb85","18552969db743280baa9f5f51d9619fb","4","0","0","0","","f83f09341b5091d41856dc6fe54bcb1f","6073c40c1bad74501087eb186e4bcb26","ATOSA661481","169","2025-05-07 12:29:32","ATOSA570299","","","Oodrive, Trusted_Key_Manager, Tracfin, Installation","0"
"KB000134849","published","2022-01-28 09:22:31","2025-05-07","2026-05-07 11:02:59","Message d'erreur au lancement d'Experia - SilverDev (Bureau iSeries)","b98d9b7f1b1974501087eb186e4bcb85","6861b68a0f9496009850ecd692050ee7","3","0","0","0","","090569cedbd14194c6032e65ca96193b","6073c40c1bad74501087eb186e4bcb26","ATOSA570299","48","2025-05-07 11:02:59","ATOSA570299","","","SilverDev, Experia, iSeries, Erreur, Error, Lancement","0"
"KB000129840","published","2021-08-02 10:55:52","2025-05-07","2026-05-07 10:43:26","File d'attente pleine sur l'imprimante Xerox 7855","b98d9b7f1b1974501087eb186e4bcb85","6861b68a0f9496009850ecd692050ee7","3","0","0","0","","6026fbf71b1d74501087eb186e4bcb4f","4a68c0441bed74501087eb186e4bcb88","ATOSA771963","48","2025-05-07 10:43:26","ATOSA570299","","","XEROX_7855, File_d'attente_pleine, MFD, Multifonction, Imprimante, Printer","0"
"KB000138247","published","2022-05-06 09:02:33","2025-05-07","2026-05-07 11:25:58","Installation et activation de MapInfo Pro","b98d9b7f1b1974501087eb186e4bcb85","6861b68a0f9496009850ecd692050ee7","3","0","0","0","","fa8d752987d38594c9b8a6440cbb35dc","6073c40c1bad74501087eb186e4bcb26","ATOSA570299","55","2025-05-07 11:25:58","ATOSA570299","","","MapInfo, MapInfo_Pro, 2019.0.3.0, Installation, Activation","0"
"KB000135221","published","2022-02-08 12:05:30","2025-05-07","2026-05-07 11:03:31","Utilisation de LAPS sur un poste SOE","b98d9b7f1b1974501087eb186e4bcb85","6861b68a0f9496009850ecd692050ee7","3","0","0","0","","d3665ea11ba58d1062460dcfe54bcbc4","6073c40c1bad74501087eb186e4bcb26","ATOSA570299","30","2025-05-07 11:03:31","ATOSA570299","","","LAPS, Poste_SOE, Admin, Utilisation, Windows","0"
"KB000148222","published","2023-03-22 14:30:10","2025-05-07","2026-05-07 12:45:43","Paramétrage de l'iPhone","b98d9b7f1b1974501087eb186e4bcb85","6861b68a0f9496009850ecd692050ee7","6","0","0","0","","98c573f71b1d74501087eb186e4bcb53","6073c40c1bad74501087eb186e4bcb26","ATOSA570299","151","2025-05-07 12:45:43","ATOSA570299","","","iPhone, Enrôlement, Paramètrage, Enrôler, Paramètrer, Intune","0"
"KB000135762","published","2022-02-23 13:32:09","2025-05-07","2026-05-07 11:04:50","Installation de logiciel - Incident ou Demande","b98d9b7f1b1974501087eb186e4bcb85","6861b68a0f9496009850ecd692050ee7","4","0","0","0","","8890b7bb1bd974501087eb186e4bcbfb","d8534cc81bad74501087eb186e4bcb14","ATOSA570299","48","2025-05-07 11:04:50","ATOSA570299","","","Logiciel, Application, Installation, Incident, Demande","0"
"KB000129847","published","2021-08-02 10:55:56","2025-05-07","2026-05-07 10:30:22","Configuration 802.1X des MFD Toshiba","b98d9b7f1b1974501087eb186e4bcb85","6861b68a0f9496009850ecd692050ee7","3","0","0","0","","6026fbf71b1d74501087eb186e4bcb4f","4a68c0441bed74501087eb186e4bcb88","ATOSA771963","63","2025-05-07 10:30:22","ATOSA570299","","","Imprimante, MFD, Toshiba 802-1x, Configuration ","0"
